,title,category,price,rating,availability
564,Musicophilia: Tales of Music and the Brain,Default,46.58,One,In stock (6 available)
565,Mere Christianity,Add a comment,48.51,Three,In stock (6 available)
566,Me Before You (Me Before You #1),Fiction,19.02,One,In stock (6 available)
567,In the Woods (Dublin Murder Squad #1),Mystery,38.38,Two,In stock (6 available)
568,In Cold Blood,Nonfiction,49.98,Four,In stock (6 available)
569,How to Stop Worrying and Start Living,Self Help,46.49,Five,In stock (6 available)
570,Give It Back,Thriller,18.32,Two,In stock (6 available)
571,"Girl, Interrupted",Nonfiction,42.14,Three,In stock (6 available)
572,Fun Home: A Family Tragicomic,Add a comment,56.59,Four,In stock (6 available)
573,"Fruits Basket, Vol. 6 (Fruits Basket #6)",Sequential Art,20.96,Four,In stock (6 available)
574,Deception Point,Fiction,40.32,Four,In stock (6 available)
575,"Death Note, Vol. 6: Give-and-Take (Death Note #6)",Sequential Art,36.39,Three,In stock (6 available)
576,Catherine the Great: Portrait of a Woman,History,58.55,Four,In stock (6 available)
577,Better Homes and Gardens New Cook Book,Food and Drink,39.61,Three,In stock (6 available)
578,An Unquiet Mind: A Memoir of Moods and Madness,Psychology,21.30,Three,In stock (6 available)
579,A Year in Provence (Provence #1),Travel,56.88,Four,In stock (6 available)
580,World Without End (The Pillars of the Earth #2),Historical Fiction,32.97,Four,In stock (5 available)
581,"Will Grayson, Will Grayson (Will Grayson, Will Grayson)",Young Adult,47.31,Four,In stock (5 available)
582,Why Save the Bankers?: And Other Essays on Our Economic and Political Crisis,Nonfiction,48.67,Two,In stock (5 available)
583,Where She Went (If I Stay #2),Young Adult,41.73,Four,In stock (5 available)
584,What If?: Serious Scientific Answers to Absurd Hypothetical Questions,Default,53.68,Four,In stock (5 available)
585,Two Summers,Young Adult,14.64,One,In stock (5 available)
586,This Is Your Brain on Music: The Science of a Human Obsession,Music,38.40,One,In stock (5 available)
587,The Secret Garden,Classics,15.08,Four,In stock (5 available)
588,The Raven King (The Raven Cycle #4),Add a comment,30.57,Two,In stock (5 available)
589,The Raven Boys (The Raven Cycle #1),Fantasy,57.74,Four,In stock (5 available)
590,The Power Greens Cookbook: 140 Delicious Superfood Recipes,Food and Drink,11.05,Five,In stock (5 available)
591,The Metamorphosis,Classics,28.58,One,In stock (5 available)
592,The Mathews Men: Seven Brothers and the War Against Hitler's U-boats,History,42.91,Five,In stock (5 available)
593,The Little Paris Bookshop,Fiction,24.73,Three,In stock (5 available)
594,The Hiding Place,History,55.91,Four,In stock (5 available)
595,The Grand Design,Science,13.76,Three,In stock (5 available)
596,The Firm,Fiction,45.56,Three,In stock (5 available)
597,The Fault in Our Stars,Default,47.22,One,In stock (5 available)
598,The False Prince (The Ascendance Trilogy #1),Fantasy,56.00,Five,In stock (5 available)
599,The Expatriates,Fiction,44.58,Two,In stock (5 available)
600,The Dream Thieves (The Raven Cycle #2),Default,34.50,One,In stock (5 available)
601,The Darkest Corners,Young Adult,11.33,Five,In stock (5 available)
602,The Crossover,Poetry,38.77,Four,In stock (5 available)
603,The 5th Wave (The 5th Wave #1),Default,11.83,Two,In stock (5 available)
604,Tell the Wind and Fire,Fantasy,45.51,Three,In stock (5 available)
605,Tell Me Three Things,Young Adult,41.81,One,In stock (5 available)
606,Talking to Girls About Duran Duran: One Young Man's Quest for True Love and a Cooler Haircut,Nonfiction,25.15,Four,In stock (5 available)
607,Siddhartha,Fiction,34.22,Five,In stock (5 available)
608,Shiver (The Wolves of Mercy Falls #1),Default,16.23,Five,In stock (5 available)
609,Remember Me?,Default,11.48,Three,In stock (5 available)
610,Red Dragon (Hannibal Lecter #1),Horror,23.37,Three,In stock (5 available)
611,Peak: Secrets from the New Science of Expertise,Science,16.28,Two,In stock (5 available)
612,My Mother Was Nuts,Nonfiction,31.63,Four,In stock (5 available)
613,Mexican Today: New and Rediscovered Recipes for Contemporary Kitchens,Food and Drink,24.91,Five,In stock (5 available)
614,Maybe Something Beautiful: How Art Transformed a Neighborhood,Childrens,22.54,One,In stock (5 available)
615,Lola and the Boy Next Door (Anna and the French Kiss #2),Young Adult,23.63,Four,In stock (5 available)
616,Logan Kade (Fallen Crest High #5.5),Academic,13.12,Two,In stock (5 available)
617,Last One Home (New Beginnings #1),Fiction,59.98,Three,In stock (5 available)
618,Killing Floor (Jack Reacher #1),Thriller,31.49,Four,In stock (5 available)
619,Kill the Boy Band,Young Adult,15.52,Five,In stock (5 available)
620,Isla and the Happily Ever After (Anna and the French Kiss #3),Young Adult,48.13,Five,In stock (5 available)
621,If I Stay (If I Stay #1),Default,38.13,Five,In stock (5 available)
622,I Know Why the Caged Bird Sings (Maya Angelou's Autobiography #1),Default,36.55,Two,In stock (5 available)
623,Harry Potter and the Deathly Hallows (Harry Potter #7),Default,23.32,One,In stock (5 available)
624,"Fruits Basket, Vol. 5 (Fruits Basket #5)",Sequential Art,16.33,One,In stock (5 available)
625,Foundation (Foundation (Publication Order) #1),Science Fiction,32.42,One,In stock (5 available)
626,Fool Me Once,Default,16.96,One,In stock (5 available)
627,Find Her (Detective D.D. Warren #8),Add a comment,22.37,One,In stock (5 available)
628,Evicted: Poverty and Profit in the American City,Add a comment,42.27,One,In stock (5 available)
629,Drama,Default,38.70,Two,In stock (5 available)
630,Dracula the Un-Dead,Horror,35.63,Five,In stock (5 available)
631,Digital Fortress,Fiction,58.00,Five,In stock (5 available)
632,"Death Note, Vol. 5: Whiteout (Death Note #5)",Sequential Art,52.41,One,In stock (5 available)
633,"Data, A Love Story: How I Gamed Online Dating to Meet My Match",Nonfiction,32.35,Three,In stock (5 available)
634,Critique of Pure Reason,Philosophy,20.75,One,In stock (5 available)
635,Booked,Poetry,17.49,Five,In stock (5 available)
636,"Blue Lily, Lily Blue (The Raven Cycle #3)",Default,34.13,Five,In stock (5 available)
637,Approval Junkie: Adventures in Caring Too Much,Autobiography,58.81,Five,In stock (5 available)
638,An Abundance of Katherines,Young Adult,10.00,Five,In stock (5 available)
639,America's War for the Greater Middle East: A Military History,History,51.22,Two,In stock (5 available)
640,Alight (The Generations Trilogy #2),Default,58.59,Four,In stock (5 available)
641,A Girl's Guide to Moving On (New Beginnings #2),Romance,31.30,One,In stock (5 available)
642,A Game of Thrones (A Song of Ice and Fire #1),Add a comment,46.42,Two,In stock (5 available)
643,A Feast for Crows (A Song of Ice and Fire #4),Fantasy,17.21,Four,In stock (5 available)
644,A Clash of Kings (A Song of Ice and Fire #2),Add a comment,10.79,Three,In stock (5 available)
645,Vogue Colors A to Z: A Fashion Coloring Book,Default,52.35,Four,In stock (4 available)
646,The Shining (The Shining #1),Default,27.88,Three,In stock (4 available)
647,The Pilgrim's Progress,Classics,50.26,Two,In stock (4 available)
648,The Perfect Play (Play by Play #1),Romance,59.99,Three,In stock (4 available)
649,The Passion of Dolssa,Historical Fiction,28.32,Five,In stock (4 available)
650,The Jazz of Physics: The Secret Link Between Music and the Structure of the Universe,Nonfiction,38.71,Three,In stock (4 available)
651,The Hunger Games (The Hunger Games #1),Default,29.85,Five,In stock (4 available)
652,The Hound of the Baskervilles (Sherlock Holmes #5),Classics,14.82,Two,In stock (4 available)
653,The Gunning of America: Business and the Making of American Gun Culture,Nonfiction,16.81,Four,In stock (4 available)
654,The Geography of Bliss: One Grump's Search for the Happiest Places in the World,Nonfiction,28.23,Two,In stock (4 available)
655,The Demonists (Demonist #1),Fantasy,52.11,Two,In stock (4 available)
656,"The Demon Prince of Momochi House, Vol. 4 (The Demon Prince of Momochi House #4)",Sequential Art,27.88,Two,In stock (4 available)
657,The Bone Hunters (Lexy Vaughan & Steven Macaulay #2),Thriller,59.71,Three,In stock (4 available)
658,The Beast (Black Dagger Brotherhood #14),Fantasy,46.08,Five,In stock (4 available)
659,Some Women,Womens Fiction,13.73,Five,In stock (4 available)
660,Shopaholic Ties the Knot (Shopaholic #3),Womens Fiction,48.39,Five,In stock (4 available)
661,Paper and Fire (The Great Library #2),Fantasy,49.45,Five,In stock (4 available)
662,Outlander (Outlander #1),Default,19.67,Five,In stock (4 available)
663,"Orchestra of Exiles: The Story of Bronislaw Huberman, the Israel Philharmonic, and the One Thousand Jews He Saved from Nazi Horrors",Music,12.36,Three,In stock (4 available)
664,No One Here Gets Out Alive,Music,20.02,Five,In stock (4 available)
665,Night Shift (Night Shift #1-20),Horror,12.75,Four,In stock (4 available)
666,Needful Things,Horror,47.51,Four,In stock (4 available)
667,Mockingjay (The Hunger Games #3),Default,20.44,Four,In stock (4 available)
668,Misery,Horror,34.79,Two,In stock (4 available)
669,Little Women (Little Women #1),Classics,28.07,Four,In stock (4 available)
670,It,Horror,25.01,Three,In stock (4 available)
671,Harry Potter and the Sorcerer's Stone (Harry Potter #1),Default,13.90,Three,In stock (4 available)
672,Harry Potter and the Prisoner of Azkaban (Harry Potter #3),Young Adult,24.17,Four,In stock (4 available)
673,Harry Potter and the Order of the Phoenix (Harry Potter #5),Fantasy,31.63,Four,In stock (4 available)
674,Harry Potter and the Half-Blood Prince (Harry Potter #6),Fantasy,48.75,Five,In stock (4 available)
675,Harry Potter and the Chamber of Secrets (Harry Potter #2),Fantasy,14.74,One,In stock (4 available)
676,Gone with the Wind,Classics,32.49,Three,In stock (4 available)
677,God Is Not Great: How Religion Poisons Everything,Nonfiction,27.80,One,In stock (4 available)
678,Girl With a Pearl Earring,Historical Fiction,26.77,One,In stock (4 available)
679,"Fruits Basket, Vol. 4 (Fruits Basket #4)",Sequential Art,50.44,Four,In stock (4 available)
680,Far From True (Promise Falls Trilogy #2),Thriller,34.93,Two,In stock (4 available)
681,Dark Lover (Black Dagger Brotherhood #1),Romance,12.87,One,In stock (4 available)
682,Confessions of a Shopaholic (Shopaholic #1),Default,48.94,Two,In stock (4 available)
683,Changing the Game (Play by Play #2),Romance,13.38,Three,In stock (4 available)
684,Candide,Classics,58.63,Three,In stock (4 available)
685,Can You Keep a Secret?,Womens Fiction,21.94,One,In stock (4 available)
686,Atlas Shrugged,Fiction,26.58,Five,In stock (4 available)
687,Animal Farm,Classics,57.22,Three,In stock (4 available)
688,A Walk to Remember,Romance,56.43,One,In stock (4 available)
689,A New Earth: Awakening to Your Life's Purpose,Spirituality,55.65,Five,In stock (4 available)
690,"A History of God: The 4,000-Year Quest of Judaism, Christianity, and Islam",Religion,27.62,One,In stock (4 available)
691,'Salem's Lot,Horror,49.56,Four,In stock (4 available)
692,Zero History (Blue Ant #3),Default,34.77,One,In stock (3 available)
693,Wuthering Heights,Classics,17.73,Three,In stock (3 available)
694,World War Z: An Oral History of the Zombie War,Default,21.80,One,In stock (3 available)
695,Wild: From Lost to Found on the Pacific Crest Trail,Default,46.02,Three,In stock (3 available)
696,"Where'd You Go, Bernadette",Default,18.13,One,In stock (3 available)
697,When You Are Engulfed in Flames,Humor,30.89,Five,In stock (3 available)
698,We the People: The Modern-Day Figures Who Have Reshaped and Affirmed the Founding Fathers' Vision of America,Nonfiction,31.95,Three,In stock (3 available)
699,We Are All Completely Beside Ourselves,Contemporary,24.04,One,In stock (3 available)
700,Walk the Edge (Thunder Road #2),Young Adult,32.36,Three,In stock (3 available)
701,Voyager (Outlander #3),Historical Fiction,21.07,Five,In stock (3 available)
702,Very Good Lives: The Fringe Benefits of Failure and the Importance of Imagination,Nonfiction,50.66,Three,In stock (3 available)
703,Vegan Vegetarian Omnivore: Dinner for Everyone at the Table,Food and Drink,13.66,Two,In stock (3 available)
704,"Unstuffed: Decluttering Your Home, Mind, and Soul",Nonfiction,58.09,One,In stock (3 available)
705,Under the Banner of Heaven: A Story of Violent Faith,Nonfiction,30.00,One,In stock (3 available)
706,Two Boys Kissing,Young Adult,32.74,Two,In stock (3 available)
707,Twilight (Twilight #1),Default,41.93,Two,In stock (3 available)
708,Twenties Girl,Womens Fiction,42.80,Two,In stock (3 available)
709,"Trespassing Across America: One Man's Epic, Never-Done-Before (and Sort of Illegal) Hike Across the Heartland",Nonfiction,53.51,One,In stock (3 available)
710,Three-Martini Lunch,Fiction,23.21,Three,In stock (3 available)
711,"Thinking, Fast and Slow",Psychology,21.14,One,In stock (3 available)
712,The Wild Robot,Childrens,56.07,Three,In stock (3 available)
713,"The Wicked + The Divine, Vol. 3: Commercial Suicide (The Wicked + The Divine)",Sequential Art,14.41,Three,In stock (3 available)
714,The Undomestic Goddess,Womens Fiction,45.75,Four,In stock (3 available)
715,The Travelers,Thriller,15.77,One,In stock (3 available)
716,The Tipping Point: How Little Things Can Make a Big Difference,Add a comment,10.02,Two,In stock (3 available)
717,The Thing About Jellyfish,Childrens,48.77,One,In stock (3 available)
718,The Stand,Horror,57.86,Two,In stock (3 available)
719,The Smitten Kitchen Cookbook,Food and Drink,23.59,One,In stock (3 available)
720,The Silkworm (Cormoran Strike #2),Mystery,23.05,Five,In stock (3 available)
721,"The Sandman, Vol. 3: Dream Country (The Sandman (volumes) #3)",Sequential Art,55.55,Five,In stock (3 available)
722,The Rose & the Dagger (The Wrath and the Dawn #2),Fantasy,58.64,Four,In stock (3 available)
723,The Road to Little Dribbling: Adventures of an American in Britain (Notes From a Small Island #2),Travel,23.21,One,In stock (3 available)
724,The Rise of Theodore Roosevelt (Theodore Roosevelt #1),Biography,42.57,Three,In stock (3 available)
725,The Restaurant at the End of the Universe (Hitchhiker's Guide to the Galaxy #2),Science Fiction,10.92,One,In stock (3 available)
726,The Rest Is Noise: Listening to the Twentieth Century,Add a comment,34.77,One,In stock (3 available)
727,The Red Tent,Historical Fiction,35.66,Five,In stock (3 available)
728,The Purpose Driven Life: What on Earth Am I Here for?,Add a comment,37.19,Three,In stock (3 available)
729,The Purest Hook (Second Circle Tattoos #3),Romance,12.25,One,In stock (3 available)
730,The Picture of Dorian Gray,Classics,29.70,Two,In stock (3 available)
731,The Paris Wife,Default,36.80,Three,In stock (3 available)
732,The Obsession,Romance,45.43,One,In stock (3 available)
733,The Nightingale,Fiction,26.26,Four,In stock (3 available)
734,The New Guy (and Other Senior Year Distractions),Young Adult,44.92,Three,In stock (3 available)
735,The Nanny Diaries (Nanny #1),Womens Fiction,52.53,Five,In stock (3 available)
736,The Name of God is Mercy,Nonfiction,37.25,Two,In stock (3 available)
737,The Maze Runner (The Maze Runner #1),Default,20.93,One,In stock (3 available)
738,The Lover's Dictionary,Default,58.09,Two,In stock (3 available)
739,The Lonely Ones,Childrens,43.59,Five,In stock (3 available)
740,The Lean Startup: How Today's Entrepreneurs Use Continuous Innovation to Create Radically Successful Businesses,Business,33.92,Three,In stock (3 available)
741,The Last Painting of Sara de Vos,Historical Fiction,55.55,Two,In stock (3 available)
742,"The Land of 10,000 Madonnas",Young Adult,29.64,Four,In stock (3 available)
743,The Infinities,Fiction,27.41,One,In stock (3 available)
744,The Husband's Secret,Fiction,52.51,Five,In stock (3 available)
745,The Hitchhiker's Guide to the Galaxy (Hitchhiker's Guide to the Galaxy #1),Add a comment,47.80,Three,In stock (3 available)
746,The Guns of August,History,14.54,Two,In stock (3 available)
747,The Guernsey Literary and Potato Peel Pie Society,Historical Fiction,49.53,One,In stock (3 available)
748,The Goldfinch,Default,43.58,Three,In stock (3 available)
749,The Giver (The Giver Quartet #1),Default,12.30,One,In stock (3 available)
750,The Girl with All the Gifts,Horror,49.47,Three,In stock (3 available)
751,The Girl Who Played with Fire (Millennium Trilogy #2),Default,22.14,Two,In stock (3 available)
752,The Girl Who Kicked the Hornet's Nest (Millennium Trilogy #3),Add a comment,57.48,One,In stock (3 available)
753,The Exiled,Mystery,43.45,Three,In stock (3 available)
754,"The End of Faith: Religion, Terror, and the Future of Reason",Add a comment,22.13,Four,In stock (3 available)
755,"The Elegant Universe: Superstrings, Hidden Dimensions, and the Quest for the Ultimate Theory",Science,13.03,Four,In stock (3 available)
756,"The Disappearing Spoon: And Other True Tales of Madness, Love, and the History of the World from the Periodic Table of the Elements",Science,57.35,Five,In stock (3 available)
757,The Devil Wears Prada (The Devil Wears Prada #1),Womens Fiction,44.29,One,In stock (3 available)
758,The Demon-Haunted World: Science as a Candle in the Dark,Default,52.25,Four,In stock (3 available)
759,The Day the Crayons Came Home (Crayons),Childrens,26.33,Five,In stock (3 available)
760,The Da Vinci Code (Robert Langdon #2),Fiction,22.96,Two,In stock (3 available)
761,The Cuckoo's Calling (Cormoran Strike #1),Mystery,19.21,One,In stock (3 available)
762,The Complete Stories and Poems (The Works of Edgar Allan Poe [Cameo Edition]),Classics,26.78,Four,In stock (3 available)
763,The Complete Poems,Add a comment,41.32,Five,In stock (3 available)
764,The Catcher in the Rye,Add a comment,24.55,One,In stock (3 available)
765,The Cat in the Hat (Beginner Books B-1),Childrens,16.26,Two,In stock (3 available)
766,The Case for Christ (Cases for Christianity),Add a comment,47.84,One,In stock (3 available)
767,The Book Thief,Default,53.49,Two,In stock (3 available)
768,The Book of Basketball: The NBA According to The Sports Guy,Sports and Games,44.84,Five,In stock (3 available)
769,The Blind Side: Evolution of a Game,Add a comment,53.71,Five,In stock (3 available)
770,The Autobiography of Malcolm X,Default,23.43,Two,In stock (3 available)
771,"The Art of Simple Food: Notes, Lessons, and Recipes from a Delicious Revolution",Food and Drink,34.32,Three,In stock (3 available)
772,The Art of Fielding,Fiction,22.10,One,In stock (3 available)
773,"Surely You're Joking, Mr. Feynman!: Adventures of a Curious Character",Science,25.83,Two,In stock (3 available)
774,Stiff: The Curious Lives of Human Cadavers,Nonfiction,36.74,Three,In stock (3 available)
775,Spilled Milk: Based on a True Story,Nonfiction,49.51,One,In stock (3 available)
776,Something Borrowed (Darcy & Rachel #1),Womens Fiction,48.96,Five,In stock (3 available)
777,Something Blue (Darcy & Rachel #2),Womens Fiction,54.62,One,In stock (3 available)
778,Soldier (Talon #3),Fantasy,24.72,Two,In stock (3 available)
779,Shopaholic & Baby (Shopaholic #5),Default,46.45,Two,In stock (3 available)
780,Seven Days in the Art World,Add a comment,52.33,Two,In stock (3 available)
781,Seven Brief Lessons on Physics,Science,30.60,Four,In stock (3 available)
782,Scarlet (The Lunar Chronicles #2),Young Adult,14.57,Four,In stock (3 available)
783,Sarah's Key,Add a comment,46.29,One,In stock (3 available)
784,"Saga, Volume 3 (Saga (Collected Editions) #3)",Sequential Art,21.57,Five,In stock (3 available)
785,Running with Scissors,Autobiography,12.91,Four,In stock (3 available)
786,Rogue Lawyer (Rogue Lawyer #1),Add a comment,50.11,Three,In stock (3 available)
787,"Rise of the Rocket Girls: The Women Who Propelled Us, from Missiles to the Moon to Mars",Nonfiction,41.67,Four,In stock (3 available)
788,Rework,Business,44.88,Two,In stock (3 available)
789,Reservations for Two,Romance,11.10,Three,In stock (3 available)
790,Red: The True Story of Red Riding Hood,Childrens,28.54,Three,In stock (3 available)
791,Ready Player One,Science Fiction,19.07,Four,In stock (3 available)
792,Quiet: The Power of Introverts in a World That Can't Stop Talking,Default,43.55,One,In stock (3 available)
793,Prodigy: The Graphic Novel (Legend: The Graphic Novel #2),Sequential Art,43.63,Three,In stock (3 available)
794,Persepolis: The Story of a Childhood (Persepolis #1-2),Sequential Art,39.13,One,In stock (3 available)
795,Packing for Mars: The Curious Science of Life in the Void,Default,56.68,Two,In stock (3 available)
796,Outliers: The Story of Success,Nonfiction,14.16,One,In stock (3 available)
797,Original Fake,Sequential Art,31.45,Three,In stock (3 available)
798,Orange Is the New Black,Default,24.61,Two,In stock (3 available)
799,One for the Money (Stephanie Plum #1),Default,32.87,Two,In stock (3 available)
800,Notes from a Small Island (Notes From a Small Island #1),Nonfiction,40.17,One,In stock (3 available)
801,Night (The Night Trilogy #1),Nonfiction,13.51,One,In stock (3 available)
802,Neither Here nor There: Travels in Europe,Travel,38.95,Three,In stock (3 available)
803,Naked,Humor,31.69,Three,In stock (3 available)
804,Morning Star (Red Rising #3),Default,29.40,One,In stock (3 available)
805,"Miracles from Heaven: A Little Girl, Her Journey to Heaven, and Her Amazing Story of Healing",Nonfiction,57.83,One,In stock (3 available)
806,Midnight Riot (Peter Grant/ Rivers of London - books #1),Fantasy,55.46,Two,In stock (3 available)
807,Me Talk Pretty One Day,Autobiography,57.60,Two,In stock (3 available)
808,Manuscript Found in Accra,Add a comment,34.98,Two,In stock (3 available)
809,Lust & Wonder,Autobiography,11.87,Two,In stock (3 available)
810,Lila (Gilead #3),Fiction,12.47,Three,In stock (3 available)
811,"Life, the Universe and Everything (Hitchhiker's Guide to the Galaxy #3)",Science Fiction,33.26,Two,In stock (3 available)
812,Life Without a Recipe,Autobiography,59.04,Five,In stock (3 available)
813,Life After Life,Default,26.13,Two,In stock (3 available)
814,Letter to a Christian Nation,Nonfiction,22.20,One,In stock (3 available)
815,Let's Pretend This Never Happened: A Mostly True Memoir,Nonfiction,45.11,One,In stock (3 available)
816,Legend (Legend #1),Young Adult,43.69,Four,In stock (3 available)
817,"Lean In: Women, Work, and the Will to Lead",Default,25.02,One,In stock (3 available)
818,"Lamb: The Gospel According to Biff, Christ's Childhood Pal",Humor,55.50,Five,In stock (3 available)
819,Lady Renegades (Rebel Belle #3),Young Adult,53.04,Five,In stock (3 available)
820,Jurassic Park (Jurassic Park #1),Fiction,44.97,One,In stock (3 available)
821,It's Never Too Late to Begin Again: Discovering Creativity and Meaning at Midlife and Beyond,Nonfiction,42.38,One,In stock (3 available)
822,Is Everyone Hanging Out Without Me? (And Other Concerns),Default,20.11,Three,In stock (3 available)
823,Into the Wild,Nonfiction,56.70,Five,In stock (3 available)
824,Inferno (Robert Langdon #4),Fiction,41.00,Five,In stock (3 available)
825,"In the Garden of Beasts: Love, Terror, and an American Family in Hitler's Berlin",Nonfiction,28.85,Three,In stock (3 available)
826,If I Run (If I Run #1),Christian Fiction,49.97,Four,In stock (3 available)
827,I've Got Your Number,Womens Fiction,19.69,One,In stock (3 available)
828,I Am Malala: The Girl Who Stood Up for Education and Was Shot by the Taliban,Nonfiction,28.88,Two,In stock (3 available)
829,Hungry Girl Clean & Hungry: Easy All-Natural Recipes for Healthy Eating in the Real World,Food and Drink,33.14,Three,In stock (3 available)
830,"House of Lost Worlds: Dinosaurs, Dynasties, and the Story of Life on Earth",History,43.70,Two,In stock (3 available)
831,House of Leaves,Horror,54.89,One,In stock (3 available)
832,Horrible Bear!,Childrens,37.52,Two,In stock (3 available)
833,Holidays on Ice,Humor,51.07,Two,In stock (3 available)
834,Heir to the Sky,Fantasy,44.07,Four,In stock (3 available)
835,Green Eggs and Ham (Beginner Books B-16),Childrens,10.79,Four,In stock (3 available)
836,"Grayson, Vol 3: Nemesis (Grayson #3)",Sequential Art,42.72,One,In stock (3 available)
837,Gratitude,Nonfiction,26.66,Five,In stock (3 available)
838,Gone Girl,Default,37.60,Five,In stock (3 available)
839,Golden (Heart of Dread #3),Young Adult,42.21,Four,In stock (3 available)
840,Girl in the Blue Coat,Historical Fiction,46.83,Two,In stock (3 available)
841,"Fruits Basket, Vol. 3 (Fruits Basket #3)",Sequential Art,45.17,Two,In stock (3 available)
842,"Friday Night Lights: A Town, a Team, and a Dream",Sports and Games,51.22,Three,In stock (3 available)
843,Fire Bound (Sea Haven/Sisters of the Heart #5),Add a comment,21.28,Four,In stock (3 available)
844,Fifty Shades Freed (Fifty Shades #3),Adult Fiction,15.36,Five,In stock (3 available)
845,Fellside,Default,38.62,One,In stock (3 available)
846,Extreme Prey (Lucas Davenport #26),Mystery,25.40,Three,In stock (3 available)
847,Eragon (The Inheritance Cycle #1),Fantasy,43.87,Three,In stock (3 available)
848,Eclipse (Twilight #3),Default,18.74,One,In stock (3 available)
849,Dune (Dune #1),Science Fiction,54.86,One,In stock (3 available)
850,Dracula,Default,52.62,Three,In stock (3 available)
851,Do Androids Dream of Electric Sheep? (Blade Runner #1),Science Fiction,51.48,One,In stock (3 available)
852,Disrupted: My Misadventure in the Start-Up Bubble,Nonfiction,15.28,Five,In stock (3 available)
853,Dead Wake: The Last Crossing of the Lusitania,Default,39.24,Five,In stock (3 available)
854,"David and Goliath: Underdogs, Misfits, and the Art of Battling Giants",Default,17.81,One,In stock (3 available)
855,Darkfever (Fever #1),Fantasy,56.02,One,In stock (3 available)
856,Dark Places,Default,23.90,Five,In stock (3 available)
857,Crazy Rich Asians (Crazy Rich Asians #1),Fiction,49.13,Five,In stock (3 available)
858,Counting Thyme,Childrens,10.62,One,In stock (3 available)
859,Cosmos,Add a comment,36.17,Two,In stock (3 available)
860,Civilization and Its Discontents,Psychology,59.95,Two,In stock (3 available)
861,Cinder (The Lunar Chronicles #1),Young Adult,26.09,One,In stock (3 available)
